{"$defs":{"fileRecord":{"additionalProperties":false,"properties":{"aliases":{"items":{"minLength":1,"type":"string"},"type":"array","uniqueItems":true},"repository_relative_posix_path":{"$ref":"#/$defs/relativePosixPath"},"sha256":{"$ref":"#/$defs/sha256"},"size_bytes":{"minimum":0,"type":"integer"},"source_id":{"minLength":1,"type":"string"},"source_locator":{"minLength":1,"type":"string"},"verification_method":{"enum":["REPOSITORY_FILE_SHA256","ARCHIVE_MEMBER_SHA256","REPOSITORY_ARCHIVE_ALIAS_BYTE_IDENTITY","PINNED_DATASET_TRAJECTORY_SHA256"]}},"required":["source_id","repository_relative_posix_path","source_locator","aliases","sha256","size_bytes","verification_method"],"type":"object"},"relativePosixPath":{"minLength":1,"pattern":"^[^/\\\\][^\\\\]*$","type":"string"},"sha256":{"pattern":"^[0-9a-f]{64}$","type":"string"}},"$id":"https://local.arc3.invalid/schemas/source_content_manifest.schema.json","$schema":"https://json-schema.org/draft/2020-12/schema","additionalProperties":false,"properties":{"answer_visibility":{"enum":["CHALLENGE_ONLY","ANSWER_VISIBLE","ANSWER_UNAVAILABLE","ENVIRONMENT_SOURCE_AND_HIDDEN_STATE_VISIBLE","SUCCESS_TRAJECTORY_VISIBLE"]},"contamination_class":{"enum":["NONE","PUBLIC_EVALUATION_INPUT_VISIBLE","PUBLIC_EVALUATION_ANSWER_VISIBLE_NOT_CONSUMED","PUBLIC_EVALUATION_SUCCESS_TRAJECTORY_CONSUMED","UNLABELED_TEST_NO_ANSWER","PRIVILEGED_ENVIRONMENT_IMPLEMENTATION"]},"content_digest":{"pattern":"^hds-source-content-manifest:[0-9a-f]{64}$","type":"string"},"development_usage":{"enum":["DISTILLATION_SOURCE","AVAILABLE_TEACHER_NOT_CONSUMED","SEALED_AUDIT_ONLY","REPLAY_HARNESS_ONLY"]},"digest_excluded_fields":{"const":["content_digest"]},"directory_merkle_root":{"pattern":"^hds-directory-merkle-v1:[0-9a-f]{64}$","type":"string"},"domain":{"enum":["ARC2","ARC3"]},"files":{"items":{"$ref":"#/$defs/fileRecord"},"minItems":1,"type":"array"},"license":{"minLength":1,"type":"string"},"manifest_id":{"pattern":"^[a-z0-9][a-z0-9._-]+$","type":"string"},"manifest_version":{"const":1},"repository_relative_posix_paths":{"items":{"$ref":"#/$defs/relativePosixPath"},"minItems":1,"type":"array","uniqueItems":true},"schema_version":{"const":"hds-source-content-manifest-v1"},"source_count":{"minimum":1,"type":"integer"},"source_profile":{"additionalProperties":false,"properties":{"profile_digest":{"pattern":"^hds-source-profile:[0-9a-f]{64}$","type":"string"},"profile_id":{"minLength":1,"type":"string"}},"required":["profile_id","profile_digest"],"type":"object"},"split_role":{"enum":["TRAIN_TEACHER","PUBLIC_EVALUATION_TEACHER","PUBLIC_EVALUATION_CONSUMED","UNLABELED_TEST","REPLAY_ONLY_SOURCE","SEALED_AUDIT"]},"upstream_commit_or_release":{"minLength":1,"type":"string"},"upstream_repository":{"minLength":1,"type":"string"}},"required":["schema_version","manifest_id","manifest_version","source_profile","domain","repository_relative_posix_paths","files","directory_merkle_root","upstream_repository","upstream_commit_or_release","split_role","answer_visibility","development_usage","contamination_class","license","source_count","digest_excluded_fields","content_digest"],"title":"PH-D01B SourceContentManifest","type":"object"}
