{"answer_visibility":"ANSWER_VISIBLE","contamination_class":"NONE","content_digest":"hds-source-content-manifest:4aee5ff978c9357b61b3fae610f35671c3ab75c2f02e96231b2c88b4d4a228e3","development_usage":"DISTILLATION_SOURCE","digest_excluded_fields":["content_digest"],"directory_merkle_root":"hds-directory-merkle-v1:d0d39f953b7e4c91169fd7006febb6096bd0a004ec05f3aa3d3deddee1d76009","domain":"ARC2","files":[{"aliases":[],"repository_relative_posix_path":"external_sources/arc2/arc-prize-2026-arc-agi-2/arc-agi_training_solutions.json","sha256":"9f07a38bd25af5e83aa5bf85c5cb1a1fefdb30f6a755256fa65429e697ca97f9","size_bytes":658743,"source_id":"archive:arc-prize-2026-arc-agi-2.zip!/arc-agi_training_solutions.json","source_locator":"arc-prize-2026-arc-agi-2.zip!/arc-agi_training_solutions.json","verification_method":"ARCHIVE_MEMBER_SHA256"}],"license":"UPSTREAM_LICENSE_NOT_DECLARED_IN_PINNED_SOURCE_METADATA","manifest_id":"source-content-arc2-training-solutions","manifest_version":1,"repository_relative_posix_paths":["external_sources/arc2/arc-prize-2026-arc-agi-2/arc-agi_training_solutions.json"],"schema_version":"hds-source-content-manifest-v1","source_count":1,"source_profile":{"profile_digest":"hds-source-profile:d772e14b8db730b3292eadbbb8d087001da2f54271c1f766cf6423cfaff1c35c","profile_id":"arc2-training-solutions"},"split_role":"TRAIN_TEACHER","upstream_commit_or_release":"archive-sha256:d00746ef4e06a515ad53bde4dff276dc8ef5a26829a0ebeafc8cf8ba6371abaa","upstream_repository":"kaggle:arc-prize-2026-arc-agi-2"}
